{
  "$schema": "./schema-metadata.schema.json",
  "provider": "Microsoft.Sql",
  "apiVersion": "2023-08-01",
  "generatedDate": "2025-10-13T21:27:30.229Z",
  "sourceFile": "Microsoft.Sql.json",
  "generatedBy": "Felix (Schema & Validation Engineer)",
  "statistics": {
    "totalInterfaces": 261,
    "totalValidators": 82,
    "linesOfTypes": 5763,
    "linesOfValidators": 2860
  },
  "resourceTypes": [
    "Microsoft.Sql/instancePools",
    "Microsoft.Sql/locations/instanceFailoverGroups",
    "Microsoft.Sql/locations/serverTrustGroups",
    "Microsoft.Sql/managedInstances",
    "Microsoft.Sql/managedInstances/administrators",
    "Microsoft.Sql/managedInstances/advancedThreatProtectionSettings",
    "Microsoft.Sql/managedInstances/azureADOnlyAuthentications",
    "Microsoft.Sql/managedInstances/databases",
    "Microsoft.Sql/managedInstances/databases/advancedThreatProtectionSettings",
    "Microsoft.Sql/managedInstances/databases/backupLongTermRetentionPolicies",
    "Microsoft.Sql/managedInstances/databases/backupShortTermRetentionPolicies",
    "Microsoft.Sql/managedInstances/databases/schemas/tables/columns/sensitivityLabels",
    "Microsoft.Sql/managedInstances/databases/securityAlertPolicies",
    "Microsoft.Sql/managedInstances/databases/transparentDataEncryption",
    "Microsoft.Sql/managedInstances/databases/vulnerabilityAssessments",
    "Microsoft.Sql/managedInstances/databases/vulnerabilityAssessments/rules/baselines",
    "Microsoft.Sql/managedInstances/distributedAvailabilityGroups",
    "Microsoft.Sql/managedInstances/dtc",
    "Microsoft.Sql/managedInstances/encryptionProtector",
    "Microsoft.Sql/managedInstances/endpointCertificates",
    "Microsoft.Sql/managedInstances/failoverGroups",
    "Microsoft.Sql/managedInstances/keys",
    "Microsoft.Sql/managedInstances/outboundFirewallRules",
    "Microsoft.Sql/managedInstances/privateLinkResources",
    "Microsoft.Sql/managedInstances/restorableDroppedDatabases/backupShortTermRetentionPolicies",
    "Microsoft.Sql/managedInstances/securityAlertPolicies",
    "Microsoft.Sql/managedInstances/serverConfigurationOptions",
    "Microsoft.Sql/managedInstances/serverTrustCertificates",
    "Microsoft.Sql/managedInstances/sqlAgent",
    "Microsoft.Sql/managedInstances/startStopSchedules",
    "Microsoft.Sql/managedInstances/vulnerabilityAssessments",
    "Microsoft.Sql/servers",
    "Microsoft.Sql/servers/administrators",
    "Microsoft.Sql/servers/advancedThreatProtectionSettings",
    "Microsoft.Sql/servers/advisors",
    "Microsoft.Sql/servers/auditingSettings",
    "Microsoft.Sql/servers/azureADOnlyAuthentications",
    "Microsoft.Sql/servers/connectionPolicies",
    "Microsoft.Sql/servers/databases",
    "Microsoft.Sql/servers/databases/advancedThreatProtectionSettings",
    "Microsoft.Sql/servers/databases/advisors",
    "Microsoft.Sql/servers/databases/auditingSettings",
    "Microsoft.Sql/servers/databases/backupLongTermRetentionPolicies",
    "Microsoft.Sql/servers/databases/backupShortTermRetentionPolicies",
    "Microsoft.Sql/servers/databases/dataMaskingPolicies",
    "Microsoft.Sql/servers/databases/dataMaskingPolicies/rules",
    "Microsoft.Sql/servers/databases/extendedAuditingSettings",
    "Microsoft.Sql/servers/databases/extensions",
    "Microsoft.Sql/servers/databases/geoBackupPolicies",
    "Microsoft.Sql/servers/databases/ledgerDigestUploads",
    "Microsoft.Sql/servers/databases/schemas/tables/columns/sensitivityLabels",
    "Microsoft.Sql/servers/databases/securityAlertPolicies",
    "Microsoft.Sql/servers/databases/syncGroups",
    "Microsoft.Sql/servers/databases/syncGroups/syncMembers",
    "Microsoft.Sql/servers/databases/transparentDataEncryption",
    "Microsoft.Sql/servers/databases/vulnerabilityAssessments",
    "Microsoft.Sql/servers/databases/vulnerabilityAssessments/rules/baselines",
    "Microsoft.Sql/servers/databases/workloadGroups",
    "Microsoft.Sql/servers/databases/workloadGroups/workloadClassifiers",
    "Microsoft.Sql/servers/devOpsAuditingSettings",
    "Microsoft.Sql/servers/disasterRecoveryConfiguration",
    "Microsoft.Sql/servers/elasticPools",
    "Microsoft.Sql/servers/encryptionProtector",
    "Microsoft.Sql/servers/extendedAuditingSettings",
    "Microsoft.Sql/servers/failoverGroups",
    "Microsoft.Sql/servers/firewallRules",
    "Microsoft.Sql/servers/ipv6FirewallRules",
    "Microsoft.Sql/servers/jobAgents",
    "Microsoft.Sql/servers/jobAgents/credentials",
    "Microsoft.Sql/servers/jobAgents/jobs",
    "Microsoft.Sql/servers/jobAgents/jobs/executions",
    "Microsoft.Sql/servers/jobAgents/jobs/steps",
    "Microsoft.Sql/servers/jobAgents/targetGroups",
    "Microsoft.Sql/servers/keys",
    "Microsoft.Sql/servers/outboundFirewallRules",
    "Microsoft.Sql/servers/privateLinkResources",
    "Microsoft.Sql/servers/securityAlertPolicies",
    "Microsoft.Sql/servers/sqlVulnerabilityAssessments",
    "Microsoft.Sql/servers/virtualNetworkRules",
    "Microsoft.Sql/servers/vulnerabilityAssessments"
  ],
  "validationFeatures": {
    "requiredProperties": true,
    "stringLengthConstraints": false,
    "numericRangeConstraints": false,
    "regexPatterns": false,
    "enumValidation": false,
    "nestedObjectValidation": false
  },
  "constraints": {
    "documented": true,
    "implemented": "partial"
  },
  "notes": [
    "Types generated from ARM schema with comprehensive interface definitions",
    "Validators implement required property checks",
    "Constraint validation (minLength, maxLength, patterns) not fully implemented",
    "All 82 resource types have corresponding validation functions",
    "TSDoc includes property descriptions from ARM schema"
  ],
  "improvements": [
    "Add regex pattern validation for resource names and properties",
    "Implement string length constraints (minLength, maxLength)",
    "Add numeric range validation (minimum, maximum)",
    "Implement enum value validation",
    "Add nested object property validation",
    "Include constraint documentation in TSDoc comments with examples"
  ]
}
